<attendanceRecords xmlns:xs="http://www.w3.org/2001/XMLSchema-instance" xs:noNamespaceSchemaLocation="./attendenceValidation.xsd">
    <attendanceRecord>
        <id>1</id>
        <stdId>101</stdId>
        <date>2024-02-17</date>
        <status>present</status>
        <classId>1</classId>
    </attendanceRecord>
    
    <attendanceRecord>
        <id>2</id>
        <stdId>102</stdId>
        <date>2024-02-17</date>
        <status>absent</status>
        <classId>1</classId>

    </attendanceRecord>
    
    <attendanceRecord>
        <id>3</id>
        <stdId>103</stdId>
        <date>2024-02-18</date>
        <status>present</status>
        <classId>1</classId>

    </attendanceRecord>
    <attendanceRecord>
        <id>4</id>
        <stdId>101</stdId>
        <date>2024-02-18</date>
        <status>present</status>
        <classId>1</classId>
    </attendanceRecord>
    
    <attendanceRecord>
        <id>5</id>
        <stdId>102</stdId>
        <date>2024-02-18</date>
        <status>absent</status>
        <classId>1</classId>
    </attendanceRecord>
    
    <attendanceRecord>
        <id>6</id>
        <stdId>103</stdId>
        <date>2024-02-18</date>
        <status>present</status>
        <classId>1</classId>
    </attendanceRecord>
</attendanceRecords>
